Title,URL,Datetime,Summary
"Dow Has Biggest Rally Since 1933, Surging 11.4% On Stimulus Hopes",https://news.google.com/articles/CAIiEFkkRLRTa5rs63AMbr6YRuAqGQgEKhAIACoHCAowj8n_CjDIrfkCMNCf6AU?hl=en-IN&gl=IN&ceid=IN%3Aen,,"At the close, the Dow Jones Industrial Average had risen by 11.4 percent to 20,704.91Wall Street posted its best performance in nearly 90 years on Tuesday, as indices rallied on hopes that lawmakers would soon agree on a massive stimulus package to blunt the coronavirus' economic impact.
The Dow Jones Industrial Average surged 11.4 percent rallying to end the session at 20,704.91, its biggest one-day percentage increase since 1933.
The tech-rich Nasdaq gained 8.1 percent to close at 7,417.86, while the broad-based S&P 500 finished the day at 2,447.33, a gain of 9.4 percent.
They also have proposed offering $500 billion to corporations, including $50 billion to revenue-strapped airlines, as well as $300 in loans to small businesses.
""The key is to get the money out as quickly as possible and not wait,"" Krosby said."
Stock futures up as investors await coronavirus response stimulus package,https://news.google.com/articles/CBMiQWh0dHBzOi8vd3d3LmNubi5jb20vMjAyMC8wMy8yNC9pbnZlc3RpbmcvZ2xvYmFsLXN0b2Nrcy9pbmRleC5odG1s0gFFaHR0cHM6Ly9hbXAuY25uLmNvbS9jbm4vMjAyMC8wMy8yNC9pbnZlc3RpbmcvZ2xvYmFsLXN0b2Nrcy9pbmRleC5odG1s?hl=en-IN&gl=IN&ceid=IN%3Aen,,"New York (CNN Business) Asian markets jumped Wednesday, following Wall Street's major surge overnight as US lawmakers inched closer to approving a stimulus bill to respond to the coronavirus crisis.
DowS&P 500NasdaqUS stock futures, though, were shaky during Asian trading hours.futures were last down 150 points, or 1%, reversing slight gains earlier in the evening.futures were down 1% andfutures were down 1.4%, also falling out of the green."
Coronavirus pandemic: Wall Street set to bounce from 3-year lows,https://news.google.com/articles/CBMie2h0dHBzOi8vd3d3LmluZGlhdG9kYXkuaW4vYnVzaW5lc3Mvc3RvcnkvY29yb25hdmlydXMtcGFuZGVtaWMtd2FsbC1zdHJlZXQtc2V0LXRvLWJvdW5jZS1mcm9tLTMteWVhci1sb3dzLTE2NTkyNDItMjAyMC0wMy0yNNIBf2h0dHBzOi8vd3d3LmluZGlhdG9kYXkuaW4vYW1wL2J1c2luZXNzL3N0b3J5L2Nvcm9uYXZpcnVzLXBhbmRlbWljLXdhbGwtc3RyZWV0LXNldC10by1ib3VuY2UtZnJvbS0zLXllYXItbG93cy0xNjU5MjQyLTIwMjAtMDMtMjQ?hl=en-IN&gl=IN&ceid=IN%3Aen,2020-03-24 19:09:38+05:30,"Wall Street was set to bounce from three-year lows on Tuesday, as signs of Washington nearing a deal on a $2 trillion economic rescue package gave a shot of optimism to markets reeling under the biggest selloff since the global financial crisis.
Follow LIVE updates on coronavirus pandemicThe benchmark index has lost $10 trillion in value since a record high last month.
While the rescue package and the Fed's historic boost will ease some pain in financial markets, traders remained doubtful of a long-lasting recovery without evidence of a peaking in the number of new COVID-19 cases.
At 08:20 am EDT, Dow e-minis were up 723 points, or 3.91 per cent, S&P 500 e-minis were up 87.75 points, or 3.95 per cent and Nasdaq 100 e-minis were up 269 points, or 3.85 per cent.
ALSO READ | Tracking coronavirus in India: Daily trends, state wise cases, patients cured and moreALSO READ | Here is what Raghuram Rajan thinks RBI can do to soften coronavirus impact on Indian economyALSO READ | Coronavirus pandemic and mental health: How we can help people in quarantineALSO READ | Coronavirus: From Covid-19 to pandemic, some key terms explainedALSO WATCH | Combating coronavirus crisis: Are we doing enough testing?"
Coronavirus: DoT writes to states to permit working of telecom personnel,https://news.google.com/articles/CBMieWh0dHBzOi8vd3d3LmRlY2NhbmhlcmFsZC5jb20vYnVzaW5lc3MvY29yb25hdmlydXMtZG90LXdyaXRlcy10by1zdGF0ZXMtdG8tcGVybWl0LXdvcmtpbmctb2YtdGVsZWNvbS1wZXJzb25uZWwtODE3MjE2Lmh0bWzSAX1odHRwczovL3d3dy5kZWNjYW5oZXJhbGQuY29tL2FtcC9idXNpbmVzcy9jb3JvbmF2aXJ1cy1kb3Qtd3JpdGVzLXRvLXN0YXRlcy10by1wZXJtaXQtd29ya2luZy1vZi10ZWxlY29tLXBlcnNvbm5lbC04MTcyMTYuaHRtbA?hl=en-IN&gl=IN&ceid=IN%3Aen,2020-03-24 19:49:55+05:30,"The Department of Telecom on Tuesday reached out to state governments over difficulties faced by personnel of service operators in their movements due to lockdowns imposed by authorities to contain coronavirus outbreak.
While telecom services have been listed within the essential services, employees maintaining the network and managing operations have complained of facing problem in their movement.
""Hence, it will be necessary that instructions reach the field level to permit personnel maintaining and providing telecom services to continue their work without interruption,"" the letter said.
Telecom companies like Reliance Jio have announced free broadband service to new customers and doubled data limit for all existing customers to support work from home in fight against coronavirus.
Read: Coronavirus India update: State-wise total number of confirmed casesState-owned telecom companies BSNL and MTNL took lead last week to announce free broadband plans and additional data for their customers to support work from home."
DoT wants nodal officers to monitor telecom infra,https://news.google.com/articles/CBMigAFodHRwczovL2Vjb25vbWljdGltZXMuaW5kaWF0aW1lcy5jb20vaW5kdXN0cnkvdGVsZWNvbS9kb3Qtd2FudHMtbm9kYWwtb2ZmaWNlcnMtdG8tbW9uaXRvci10ZWxlY29tLWluZnJhL2FydGljbGVzaG93Lzc0Nzk5ODEzLmNtc9IBe2h0dHBzOi8vbS5lY29ub21pY3RpbWVzLmNvbS9pbmR1c3RyeS90ZWxlY29tL2RvdC13YW50cy1ub2RhbC1vZmZpY2Vycy10by1tb25pdG9yLXRlbGVjb20taW5mcmEvYW1wX2FydGljbGVzaG93Lzc0Nzk5ODEzLmNtcw?hl=en-IN&gl=IN&ceid=IN%3Aen,2020-03-25 04:14:00+00:00,"Muntazir.Abbas@timesinternet.inNEW DELHI The Department of Telecommunications (DoT) has asked chief secretaries of states and advisors to UT administrators to designate nodal officers to ensure maintenance of telecom infrastructure amid curfew and lockdown.Telecom secretary Anshu Prakash said in a March 24 letter that ""telecom infrastructure is critical for maintaining communication, use of broadband and internet services, encouraging e-commerce and facilitating work from home during the restriction period.”The development comes on the back of multiple complaints particularly in Punjab and Maharashtra where local law enforcement authorities were not allowing service operators and infrastructure providers' field workforce to visit sites requiring maintenance.Prakash sought intervention from state officials to allow operational continuity of telecom services, considered essential and critical to enabling work from home (WFH) as multinationals primarily IT/ITes companies have advised their staff to stay indoors.Thirty states and union territories are facing restrictions on public movement due to lockdown and curfew.
""It will be necessary that instructions reach field level to permit personnel maintaining and providing telecom services to continue their work without interruption,"" the top official said.Several instances, according to the top official, were being reported where the local authorities have asked the personnel of the telecom service providers at network operation centres and call centres to shut down operations in view of the restrictions.
""Efforts are being made by the Centre and state government as well as telcos and infrastructure providers for the smooth functioning of telecom services and operations in respective states,"" said TR Dua, director-general at Tower & Infrastructure Providers Association (Taipa)."
